<?xml version="1.0" encoding="UTF-8"?>
<structure xmlns:xsi="http://www.w3.org/2001/XMLSchema-instance"
           xmlns="http://eu.europa.ec.digit.leos.pilot/schema/"
           xsi:schemaLocation="http://eu.europa.ec.digit.leos.pilot/schema/ structure_1.xsd">

    <name>structure_04.xml</name>
    <description>Structure used for Annex with article</description>
    <version>1</version>

    <tocItems>
        <tocItem>
            <aknTag>preface</aknTag>
            <root>true</root>
            <draggable>false</draggable>
            <childrenAllowed>false</childrenAllowed>
            <display>true</display>
            <itemNumber>none</itemNumber>
            <itemHeading>none</itemHeading>
            <itemDescription>true</itemDescription>
            <numberEditable>false</numberEditable>
            <contentDisplayed>false</contentDisplayed>
            <deletable>false</deletable>
            <numWithType>false</numWithType>
            <expandedByDefault>true</expandedByDefault>
            <sameParentAsChild>false</sameParentAsChild>
            <numberingType>NONE</numberingType>
            <editable>false</editable>
        </tocItem>

        <tocItem>
            <aknTag>mainBody</aknTag>
            <root>true</root>
            <draggable>false</draggable>
            <childrenAllowed>true</childrenAllowed>
            <display>true</display>
            <itemNumber>none</itemNumber>
            <itemHeading>none</itemHeading>
            <itemDescription>true</itemDescription>
            <numberEditable>false</numberEditable>
            <contentDisplayed>false</contentDisplayed>
            <deletable>false</deletable>
            <numWithType>false</numWithType>
            <expandedByDefault>true</expandedByDefault>
            <sameParentAsChild>false</sameParentAsChild>
            <numberingType>NONE</numberingType>
            <editable>false</editable>
        </tocItem>

        <tocItem>
            <aknTag>part</aknTag>
            <root>false</root>
            <draggable>true</draggable>
            <childrenAllowed>true</childrenAllowed>
            <display>true</display>
            <itemNumber>mandatory</itemNumber>
            <autoNumbering>false</autoNumbering>
            <itemHeading>mandatory</itemHeading>
            <itemDescription>true</itemDescription>
            <numberEditable>true</numberEditable>
            <contentDisplayed>false</contentDisplayed>
            <deletable>true</deletable>
            <numWithType>true</numWithType>
            <expandedByDefault>true</expandedByDefault>
            <sameParentAsChild>false</sameParentAsChild>
            <numberingType>ROMAN_UPPER</numberingType>
            <editable>false</editable>
            <template><![CDATA[<part xml:id="_${id}"><num>${num}</num><heading>${heading}</heading></part>]]></template>
        </tocItem>

        <tocItem>
            <aknTag>title</aknTag>
            <root>false</root>
            <draggable>true</draggable>
            <childrenAllowed>true</childrenAllowed>
            <display>true</display>
            <itemNumber>mandatory</itemNumber>
            <autoNumbering>false</autoNumbering>
            <itemHeading>mandatory</itemHeading>
            <itemDescription>true</itemDescription>
            <numberEditable>true</numberEditable>
            <contentDisplayed>false</contentDisplayed>
            <deletable>true</deletable>
            <numWithType>true</numWithType>
            <expandedByDefault>true</expandedByDefault>
            <sameParentAsChild>false</sameParentAsChild>
            <numberingType>ROMAN_UPPER</numberingType>
            <editable>false</editable>
            <template><![CDATA[<title xml:id="_${id}"><num>${num}</num><heading>${heading}</heading></title>]]></template>
        </tocItem>

        <tocItem>
            <aknTag>chapter</aknTag>
            <root>false</root>
            <draggable>true</draggable>
            <childrenAllowed>true</childrenAllowed>
            <display>true</display>
            <itemNumber>mandatory</itemNumber>
            <autoNumbering>false</autoNumbering>
            <itemHeading>mandatory</itemHeading>
            <itemDescription>true</itemDescription>
            <numberEditable>true</numberEditable>
            <contentDisplayed>false</contentDisplayed>
            <deletable>true</deletable>
            <numWithType>true</numWithType>
            <expandedByDefault>true</expandedByDefault>
            <sameParentAsChild>false</sameParentAsChild>
            <numberingType>HIGHER_ELEMENT_NUM</numberingType>
            <editable>false</editable>
            <template><![CDATA[<chapter xml:id="_${id}"><num>${num}</num><heading>${heading}</heading></chapter>]]></template>
        </tocItem>

        <tocItem>
            <aknTag>section</aknTag>
            <root>false</root>
            <draggable>true</draggable>
            <childrenAllowed>true</childrenAllowed>
            <display>true</display>
            <itemNumber>mandatory</itemNumber>
            <autoNumbering>false</autoNumbering>
            <itemHeading>mandatory</itemHeading>
            <itemDescription>true</itemDescription>
            <numberEditable>true</numberEditable>
            <contentDisplayed>false</contentDisplayed>
            <deletable>true</deletable>
            <numWithType>true</numWithType>
            <expandedByDefault>true</expandedByDefault>
            <sameParentAsChild>false</sameParentAsChild>
            <numberingType>ARABIC_PARENTHESIS</numberingType>
            <editable>false</editable>
            <template><![CDATA[<section xml:id="_${id}"><num>${num}</num><heading>${heading}</heading></section>]]></template>
        </tocItem>

        <tocItem>
            <aknTag>heading</aknTag>
            <root>false</root>
            <draggable>false</draggable>
            <childrenAllowed>false</childrenAllowed>
            <display>false</display>
            <itemNumber>none</itemNumber>
            <autoNumbering>false</autoNumbering>
            <itemHeading>none</itemHeading>
            <itemDescription>true</itemDescription>
            <numberEditable>false</numberEditable>
            <contentDisplayed>false</contentDisplayed>
            <deletable>false</deletable>
            <numWithType>false</numWithType>
            <expandedByDefault>true</expandedByDefault>
            <sameParentAsChild>false</sameParentAsChild>
            <numberingType>NONE</numberingType>
            <profiles>
                <profile>
                    <elementSelector>heading:not(article heading)</elementSelector>
                    <profileName>inlineAknHeading</profileName>
                </profile>
            </profiles>
            <editable>true</editable>
        </tocItem>

        <tocItem>
            <aknTag>article</aknTag>
            <root>false</root>
            <draggable>true</draggable>
            <childrenAllowed>false</childrenAllowed>
            <display>true</display>
            <itemNumber>mandatory</itemNumber>
            <autoNumbering>true</autoNumbering>
            <itemHeading>optional</itemHeading>
            <itemDescription>true</itemDescription>
            <numberEditable>false</numberEditable>
            <contentDisplayed>true</contentDisplayed>
            <deletable>true</deletable>
            <numWithType>true</numWithType>
            <expandedByDefault>true</expandedByDefault>
            <sameParentAsChild>false</sameParentAsChild>
            <numberingType>ARABIC</numberingType>
            <tocItemTypes>
                <tocItemType>
                    <name>REGULAR</name>
                    <subElementNumberingConfigs>
                        <subElementNumberingConfig>
                            <subElement>point</subElement>
                            <numberingType>POINT_NUM</numberingType>
                        </subElementNumberingConfig>
                        <subElementNumberingConfig>
                            <subElement>indent</subElement>
                            <numberingType>POINT_NUM</numberingType>
                        </subElementNumberingConfig>
                    </subElementNumberingConfigs>
                </tocItemType>
                <tocItemType>
                    <name>DEFINITION</name>
                    <attribute>
                        <attributeName>refersTo</attributeName>
                        <attributeValue>~_ART_DEF</attributeValue>
                    </attribute>
                    <subElementNumberingConfigs>
                        <subElementNumberingConfig>
                            <subElement>point</subElement>
                            <numberingType>POINT_NUM_DEF</numberingType>
                        </subElementNumberingConfig>
                        <subElementNumberingConfig>
                            <subElement>indent</subElement>
                            <numberingType>POINT_NUM_DEF</numberingType>
                        </subElementNumberingConfig>
                    </subElementNumberingConfigs>
                </tocItemType>
            </tocItemTypes>
            <profiles>
                <profile>
                    <profileName>inlineAknArticle</profileName>
                </profile>
            </profiles>
            <editable>true</editable>
            <template><![CDATA[<article xml:id="_${id}"><num leos:editable="false">${num}</num><heading>${heading}</heading><paragraph xml:id="_${id}-par1"><num>1.</num><content><p>${default.content.text}</p></content></paragraph></article>]]></template>
        </tocItem>

        <tocItem>
            <aknTag>paragraph</aknTag>
            <root>false</root>
            <draggable>false</draggable>
            <childrenAllowed>true</childrenAllowed>
            <display>false</display>
            <itemNumber>optional</itemNumber>
            <autoNumbering>true</autoNumbering>